<?xml version="1.0" ?><p:programa xmlns:p="http://www.example.org/ejercicio1-2" xmlns:xsi="http://www.w3.org/2001/XMLSchema-instance" xsi:schemaLocation="http://www.example.org/ejercicio1-2 Ejercicio1-2.xsd " id="asi-se-hizo"><p:nombre>Así se hizo</p:nombre><p:URLprograma>http://www.rtve.es/m/alacarta/videos/asi-se-hizo/?media=tve</p:URLprograma><p:URLimagen>http://img.rtve.es/imagenes/asi-se-hizo/1298632031035.png</p:URLimagen><p:emision titulo="Invasor" fecha="2012-12-01" tiempo="00:12:04" URL="http://www.rtve.es/m/alacarta/videos/asi-se-hizo/asi-se-hizo-invasor/1597427/?media=tve"></p:emision><p:emision titulo="25 Kilates" fecha="2009-06-21" tiempo="00:14:54" URL="http://www.rtve.es/m/alacarta/videos/asi-se-hizo/asi-se-hizo-25-kilates/532296/?media=tve"></p:emision><p:emision titulo="NO-DO" fecha="2009-06-21" tiempo="00:22:20" URL="http://www.rtve.es/m/alacarta/videos/asi-se-hizo/asi-se-hizo-no-do/532301/?media=tve"></p:emision><p:emision titulo="Los mundos de Coraline" fecha="2009-06-15" tiempo="00:21:55" URL="http://www.rtve.es/m/alacarta/videos/asi-se-hizo/asi-se-hizo-mundos-coraline/532286/?media=tve"></p:emision><p:emision titulo="Antes de morir piensa " fecha="2009-06-13" tiempo="00:16:12" URL="http://www.rtve.es/m/alacarta/videos/asi-se-hizo/asi-se-hizo-antes-morir-piensa/543133/?media=tve"></p:emision><p:emision titulo="Coco, de la rebeldía a la leyenda" fecha="2009-06-13" tiempo="00:13:59" URL="http://www.rtve.es/m/alacarta/videos/asi-se-hizo/asi-se-hizo-coco-rebeldia-leyenda/532280/?media=tve"></p:emision><p:emision titulo="Fighting: Puños de asf" fecha="2009-06-13" tiempo="00:12:46" URL="http://www.rtve.es/m/alacarta/videos/asi-se-hizo/asi-se-hizo-fighting-punos-asfalto/532268/?media=tve"></p:emision><p:emision titulo="Terminator Salvation" fecha="2009-06-08" tiempo="00:23:51" URL="http://www.rtve.es/m/alacarta/videos/asi-se-hizo/asi-se-hizo-terminator-salvation/532304/?media=tve"></p:emision></p:programa>