<?xml version="1.0" ?>
<p:programa xmlns:p="http://www.example.org/ejercicio1-2"
	xmlns:xsi="http://www.w3.org/2001/XMLSchema-instance"
	xsi:schemaLocation="http://www.example.org/ejercicio1-2 Ejercicio1-2.xsd "
	id="ana-y-los-siete">
	<p:nombre>Ana y los siete</p:nombre>
	<p:URLprograma>http://www.rtve.es/m/alacarta/videos/ana-y-los-siete/?media=tve</p:URLprograma>
	<p:URLimagen>http://img.rtve.es/imagenes/ana-siete/1355752220204.jpg</p:URLimagen>
	<p:emision titulo="Episodio 91 - La esperada boda (II)"
		fecha="2013-09-01" tiempo="00:51:40"
		URL="http://www.rtve.es/m/alacarta/videos/ana-y-los-siete/ana-siete-episodio-91-esperada-boda-ii/1622902/?media=tve"></p:emision>
	<p:emision titulo="Episodio 90 - La esperada boda I" fecha="2012-12-21"
		tiempo="00:01:00"
		URL="http://www.rtve.es/m/alacarta/videos/ana-y-los-siete/ana-siete-episodio-90-esperada-boda/1621419/?media=tve"></p:emision>
	<p:emision titulo="Episodio 89 - ¿Y ahorá qué?" fecha="2012-12-20"
		tiempo="00:59:20"
		URL="http://www.rtve.es/m/alacarta/videos/ana-y-los-siete/ana-siente-episodio-89-ahora/1620062/?media=tve"></p:emision>
	<p:emision titulo="Episodio 88 - Un paso más" fecha="2012-12-19"
		tiempo="00:01:02"
		URL="http://www.rtve.es/m/alacarta/videos/ana-y-los-siete/ana-siete-episodio-88-paso-mas/1618806/?media=tve"></p:emision>
	<p:emision titulo="Episodio 87 - Maniobras" fecha="2012-12-18"
		tiempo="00:01:04"
		URL="http://www.rtve.es/m/alacarta/videos/ana-y-los-siete/ana-siete-episodio-87-maniobras/1617362/?media=tve"></p:emision>
	<p:emision titulo="Episodio 86 - Dudas de los Hidalgo" fecha="2012-12-18"
		tiempo="00:01:02"
		URL="http://www.rtve.es/m/alacarta/videos/ana-y-los-siete/ana-siete-episodio-86-dudas-hidalgo/1616188/?media=tve"></p:emision>
	<p:emision titulo="Episodio 85 - A veces oigo voces" fecha="2012-12-17"
		tiempo="00:56:34"
		URL="http://www.rtve.es/m/alacarta/videos/ana-y-los-siete/ana-siete-episodio-85-veces-oigo-voces/1612712/?media=tve"></p:emision>
	<p:emision titulo="Episodio 84 - De mal en peor" fecha="2012-12-14"
		tiempo="00:01:01"
		URL="http://www.rtve.es/m/alacarta/videos/ana-y-los-siete/ana-siete-episodio-84-mal-peor/1611229/?media=tve"></p:emision>
</p:programa>