<?xml version="1.0" ?><p:programa xmlns:p="http://www.example.org/ejercicio1-2" xmlns:xsi="http://www.w3.org/2001/XMLSchema-instance" xsi:schemaLocation="http://www.example.org/ejercicio1-2 Ejercicio1-2.xsd " id="centro-medico"><p:nombre>Centro médico</p:nombre><p:URLprograma>http://www.rtve.es/m/alacarta/videos/centro-medico/?media=tve</p:URLprograma><p:URLimagen>http://img.rtve.es/imagenes/centro-medico/1445510677793.png</p:URLimagen><p:emision titulo="Centro médico - 29/03/17 (2)     " fecha="2017-03-29" tiempo="00:33:53" URL="http://www.rtve.es/m/alacarta/videos/centro-medico/centro-medico-29-03-17-2/3961538/?media=tve"></p:emision><p:emision titulo="Centro médico - 29/03/17 (1)     " fecha="2017-03-29" tiempo="00:32:13" URL="http://www.rtve.es/m/alacarta/videos/centro-medico/centro-medico-29-03-17-1/3961474/?media=tve"></p:emision><p:emision titulo="Centro médico - 28/03/17 (2)    " fecha="2017-03-28" tiempo="00:34:04" URL="http://www.rtve.es/m/alacarta/videos/centro-medico/centro-medico-28-03-17-2/3960181/?media=tve"></p:emision><p:emision titulo="Centro médico - 28/03/17 (1)        " fecha="2017-03-28" tiempo="00:33:42" URL="http://www.rtve.es/m/alacarta/videos/centro-medico/centro-medico-28-03-17-1/3960164/?media=tve"></p:emision><p:emision titulo="Centro médico - 27/03/17 (2)   " fecha="2017-03-27" tiempo="00:34:19" URL="http://www.rtve.es/m/alacarta/videos/centro-medico/centro-medico-27-03-17-2/3959047/?media=tve"></p:emision><p:emision titulo="Centro médico - 27/03/17 (1)       " fecha="2017-03-27" tiempo="00:32:49" URL="http://www.rtve.es/m/alacarta/videos/centro-medico/centro-medico-27-03-17-1/3959041/?media=tve"></p:emision><p:emision titulo="Centro médico - 24/03/17 (2)" fecha="2017-03-24" tiempo="00:34:05" URL="http://www.rtve.es/m/alacarta/videos/centro-medico/centro-medico-500/3956173/?media=tve"></p:emision><p:emision titulo="Centro médico - 24/03/17 (1)" fecha="2017-03-24" tiempo="00:32:49" URL="http://www.rtve.es/m/alacarta/videos/centro-medico/centro-medico-24-03-17-1/3956187/?media=tve"></p:emision></p:programa>