<?xml version="1.0" ?><p:programa xmlns:p="http://www.example.org/ejercicio1-2" xmlns:xsi="http://www.w3.org/2001/XMLSchema-instance" xsi:schemaLocation="http://www.example.org/ejercicio1-2 Ejercicio1-2.xsd " id="cantame-como-paso"><p:nombre>Cántame cómo pasó</p:nombre><p:URLprograma>http://www.rtve.es/m/alacarta/videos/cantame-como-paso/?media=tve</p:URLprograma><p:URLimagen>http://img.rtve.es/imagenes/cantame-como-paso/1296550456064.png</p:URLimagen><p:emision titulo="Final 2ª parte" fecha="2010-06-04" tiempo="00:36:16" URL="http://www.rtve.es/m/alacarta/videos/cantame-como-paso/cantame-como-paso-final-2-parte/791040/?media=tve"></p:emision><p:emision titulo="Final 1ª parte" fecha="2010-06-04" tiempo="00:1:54" URL="http://www.rtve.es/m/alacarta/videos/cantame-como-paso/cantame-como-paso-final-1-parte/791030/?media=tve"></p:emision><p:emision titulo="Programa 4" fecha="2010-05-28" tiempo="00:2:13" URL="http://www.rtve.es/m/alacarta/videos/cantame-como-paso/cantame-como-paso-28-05-2010/785402/?media=tve"></p:emision><p:emision titulo="Programa 3" fecha="2010-05-21" tiempo="00:1:59" URL="http://www.rtve.es/m/alacarta/videos/cantame-como-paso/cantame-como-paso-21-05-10/778975/?media=tve"></p:emision><p:emision titulo="Programa 2" fecha="2010-05-14" tiempo="00:2:07" URL="http://www.rtve.es/m/alacarta/videos/cantame-como-paso/cantame-como-paso-14-05-10/772255/?media=tve"></p:emision><p:emision titulo="Programa 1" fecha="2010-05-07" tiempo="00:2:02" URL="http://www.rtve.es/m/alacarta/videos/cantame-como-paso/cantame-como-paso-estreno-07-05-10/765501/?media=tve"></p:emision><p:emision titulo="Casting" fecha="2010-04-23" tiempo="00:1:01" URL="http://www.rtve.es/m/alacarta/videos/cantame-como-paso/especial-casting-cantame/753521/?media=tve"></p:emision><p:emision titulo="Filomena Fernández Zambrano" fecha="2010-02-15" tiempo="00:1:09" URL="http://www.rtve.es/m/alacarta/videos/cantame-como-paso/cantame-como-paso-filomena-fernandez-herminia/711749/?media=tve"></p:emision></p:programa>