<?xml version="1.0" ?><p:programa xmlns:p="http://www.example.org/ejercicio1-2" xmlns:xsi="http://www.w3.org/2001/XMLSchema-instance" xsi:schemaLocation="http://www.example.org/ejercicio1-2 Ejercicio1-2.xsd " id="carlos-de-gante"><p:nombre>Carlos de Gante</p:nombre><p:URLprograma>http://www.rtve.es/m/alacarta/audios/carlos-de-gante/?media=tve</p:URLprograma><p:URLimagen>http://img.rtve.es/imagenes/carlos-gante/1441275607567.png</p:URLimagen><p:emision titulo="Carlos de Gante - Capítulo 5: &quot;El tablero de Europa&quot;" fecha="2015-09-30" tiempo="00:6:07" URL="http://www.rtve.es/m/alacarta/audios/carlos-de-gante/carlos-gante-capitulo-5-tablero-europa/3266262/?media=tve"></p:emision><p:emision titulo="Carlos de Gante - Capítulo 4: &quot;Príncipe y caballero&quot;" fecha="2015-09-23" tiempo="00:7:21" URL="http://www.rtve.es/m/alacarta/audios/carlos-de-gante/carlos-gante-capitulo-4-principe-caballero/3266320/?media=tve"></p:emision><p:emision titulo="Carlos de Gante - Capítulo 3: &quot;Matar al padre&quot;" fecha="2015-09-16" tiempo="00:5:56" URL="http://www.rtve.es/m/alacarta/audios/carlos-de-gante/carlos-gante-capitulo-3-matar-padre-chievres/3266318/?media=tve"></p:emision><p:emision titulo="Carlos de Gante - Capítulo 2: &quot;Mujeres en el poder&quot;" fecha="2015-09-09" tiempo="00:6:41" URL="http://www.rtve.es/m/alacarta/audios/carlos-de-gante/carlos-cap-2-2015-08-27t10-57-434301339/3266319/?media=tve"></p:emision><p:emision titulo="Carlos de Gante - Capítulo 1: &quot;Hijo de rey&quot;" fecha="2015-09-02" tiempo="00:7:29" URL="http://www.rtve.es/m/alacarta/audios/carlos-de-gante/carlos-gante-capitulo-1-hijo-rey/3266263/?media=tve"></p:emision></p:programa>