<?xml version="1.0" ?>
<p:programa xmlns:p="http://www.example.org/ejercicio1-2"
	xmlns:xsi="http://www.w3.org/2001/XMLSchema-instance"
	xsi:schemaLocation="http://www.example.org/ejercicio1-2 Ejercicio1-2.xsd "
	id="amar-en-tiempos-revueltos">
	<p:nombre>Amar en tiempos revueltos</p:nombre>
	<p:URLprograma>http://www.rtve.es/m/alacarta/videos/amar-en-tiempos-revueltos/?media=tve</p:URLprograma>
	<p:URLimagen>http://img.rtve.es/imagenes/amar-tiempos-revueltos/1488798760813.png</p:URLimagen>
	<p:emision titulo="T7 - Capítulo 256 - Final 2ª Parte" fecha="2012-11-16"
		tiempo="00:56:12"
		URL="http://www.rtve.es/m/alacarta/videos/amar-en-tiempos-revueltos/amar-tiempos-revueltos-t7-capitulo-256-final-2-parte/1580482/?media=tve"></p:emision>
	<p:emision titulo="T7 - Capítulo 255 - Final 1ª parte" fecha="2012-11-16"
		tiempo="00:54:55"
		URL="http://www.rtve.es/m/alacarta/videos/amar-en-tiempos-revueltos/amar-tiempos-revueltos-t7-capitulo-255-final-1-parte/1580102/?media=tve"></p:emision>
	<p:emision titulo="T7 - Capítulo 254" fecha="2012-11-15"
		tiempo="00:54:42"
		URL="http://www.rtve.es/m/alacarta/videos/amar-en-tiempos-revueltos/amar-tiempos-revueltos-t7-capitulo-254/1580324/?media=tve"></p:emision>
	<p:emision titulo="T7 - Capítulo 253" fecha="2012-11-13"
		tiempo="00:55:10"
		URL="http://www.rtve.es/m/alacarta/videos/amar-en-tiempos-revueltos/amar-tiempos-revueltos-t7-capitulo-253/1578684/?media=tve"></p:emision>
	<p:emision titulo="T7 - Capítulo 252" fecha="2012-11-12"
		tiempo="00:54:03"
		URL="http://www.rtve.es/m/alacarta/videos/amar-en-tiempos-revueltos/amar-tiempos-revueltos-t7-capitulo-252/1577813/?media=tve"></p:emision>
	<p:emision titulo="T7 - Capítulo 251" fecha="2012-11-09"
		tiempo="00:54:26"
		URL="http://www.rtve.es/m/alacarta/videos/amar-en-tiempos-revueltos/amar-tiempos-revueltos-t7-capitulo-251/1574546/?media=tve"></p:emision>
	<p:emision titulo="T7 - Capítulo 250" fecha="2012-11-08"
		tiempo="00:54:44"
		URL="http://www.rtve.es/m/alacarta/videos/amar-en-tiempos-revueltos/amar-tiempos-revueltos-t7-capitulo-250/1574547/?media=tve"></p:emision>
	<p:emision titulo="T7 - Capítulo 249" fecha="2012-11-07"
		tiempo="00:54:50"
		URL="http://www.rtve.es/m/alacarta/videos/amar-en-tiempos-revueltos/amar-tiempos-revueltos-t7-capitulo-249/1573352/?media=tve"></p:emision>
</p:programa>