<?xml version="1.0" ?><p:programa xmlns:p="http://www.example.org/ejercicio1-2" xmlns:xsi="http://www.w3.org/2001/XMLSchema-instance" xsi:schemaLocation="http://www.example.org/ejercicio1-2 Ejercicio1-2.xsd " id="balas-de-plata"><p:nombre>Balas de plata</p:nombre><p:URLprograma>http://www.rtve.es/m/alacarta/videos/balas-de-plata/?media=tve</p:URLprograma><p:URLimagen>http://img.rtve.es/imagenes/balas-plata/1344519535411.jpg</p:URLimagen><p:emision titulo="Balas de plata - 18/07/08" fecha="2008-07-18" tiempo="00:1:06" URL="http://www.rtve.es/m/alacarta/videos/balas-de-plata/balas-plata-18-07-08/218205/?media=tve"></p:emision><p:emision titulo="Balas de plata - 10/07/08" fecha="2008-07-10" tiempo="00:1:09" URL="http://www.rtve.es/m/alacarta/videos/balas-de-plata/balas-plata-10-07-08/211512/?media=tve"></p:emision><p:emision titulo="Balas de plata - 03/07/08" fecha="2008-07-03" tiempo="00:54:56" URL="http://www.rtve.es/m/alacarta/videos/balas-de-plata/balas-plata-03-07-08/207072/?media=tve"></p:emision><p:emision titulo="Balas de plata - 27/06/08" fecha="2008-06-27" tiempo="00:1:02" URL="http://www.rtve.es/m/alacarta/videos/balas-de-plata/balas-plata-27-06-08/191392/?media=tve"></p:emision><p:emision titulo="Balas de plata - 19/06/08" fecha="2008-06-19" tiempo="00:59:56" URL="http://www.rtve.es/m/alacarta/videos/balas-de-plata/balas-plata-19-06-08/170452/?media=tve"></p:emision><p:emision titulo="Balas de plata - 12/06/08" fecha="2008-06-12" tiempo="00:1:09" URL="http://www.rtve.es/m/alacarta/videos/balas-de-plata/balas-plata-12-06-08/148392/?media=tve"></p:emision><p:emision titulo="Balas de plata - 05/06/08" fecha="2008-06-05" tiempo="00:1:01" URL="http://www.rtve.es/m/alacarta/videos/balas-de-plata/balas-plata-05-06-08/127792/?media=tve"></p:emision><p:emision titulo="Balas de plata - 30/05/08" fecha="2008-05-30" tiempo="00:1:05" URL="http://www.rtve.es/m/alacarta/videos/balas-de-plata/balas-plata-30-05-08/110732/?media=tve"></p:emision></p:programa>