<?xml version="1.0" ?><p:programa xmlns:p="http://www.example.org/ejercicio1-2" xmlns:xsi="http://www.w3.org/2001/XMLSchema-instance" xsi:schemaLocation="http://www.example.org/ejercicio1-2 Ejercicio1-2.xsd " id="aqui-la-tierra"><p:nombre>Aquí la Tierra</p:nombre><p:URLprograma>http://www.rtve.es/m/alacarta/videos/aqui-la-tierra/?media=tve</p:URLprograma><p:URLimagen>http://img.rtve.es/imagenes/aqui-tierra/1412768845520.png</p:URLimagen><p:emision titulo="Aquí la Tierra - 29/03/17        " fecha="2017-03-29" tiempo="00:28:36" URL="http://www.rtve.es/m/alacarta/videos/aqui-la-tierra/aqui-tierra-29-03-17/3961573/?media=tve"></p:emision><p:emision titulo="Aquí la Tierra - 28/03/17      " fecha="2017-03-28" tiempo="00:28:31" URL="http://www.rtve.es/m/alacarta/videos/aqui-la-tierra/aqui-tierra-28-03-17/3960210/?media=tve"></p:emision><p:emision titulo="Aquí la Tierra - 27/03/17        " fecha="2017-03-27" tiempo="00:29:43" URL="http://www.rtve.es/m/alacarta/videos/aqui-la-tierra/aqui-tierra-27-03-17/3959084/?media=tve"></p:emision><p:emision titulo="Aquí la Tierra - 26/03/17" fecha="2017-03-26" tiempo="00:31:30" URL="http://www.rtve.es/m/alacarta/videos/aqui-la-tierra/aqui-tierra-26-03-17/3957624/?media=tve"></p:emision><p:emision titulo="Aquí la tierra - 23/03/17" fecha="2017-03-23" tiempo="00:29:18" URL="http://www.rtve.es/m/alacarta/videos/aqui-la-tierra/aqui-tierra-23-03-17/3955012/?media=tve"></p:emision><p:emision titulo="Aquí la tierra - 22/03/17" fecha="2017-03-22" tiempo="00:29:21" URL="http://www.rtve.es/m/alacarta/videos/aqui-la-tierra/aqui-tierra-22-03-17/3953847/?media=tve"></p:emision><p:emision titulo="Aquí la tierra - 21/03/17" fecha="2017-03-21" tiempo="00:30:06" URL="http://www.rtve.es/m/alacarta/videos/aqui-la-tierra/aqui-tierra-21-03-17/3952123/?media=tve"></p:emision><p:emision titulo="Aquí la Tierra - 20/03/17" fecha="2017-03-20" tiempo="00:29:40" URL="http://www.rtve.es/m/alacarta/videos/aqui-la-tierra/aqui-tierra-20-03-17/3950335/?media=tve"></p:emision></p:programa>