<?xml version="1.0" ?><p:programa xmlns:p="http://www.example.org/ejercicio1-2" xmlns:xsi="http://www.w3.org/2001/XMLSchema-instance" xsi:schemaLocation="http://www.example.org/ejercicio1-2 Ejercicio1-2.xsd " id="campanadas-de-fin-de-ano"><p:nombre>Campanadas de Fin de Año</p:nombre><p:URLprograma>http://www.rtve.es/m/alacarta/videos/campanadas-de-fin-de-ano/?media=tve</p:URLprograma><p:URLimagen>http://img.rtve.es/imagenes/campanadas-fin-ano/1351176107473.jpg</p:URLimagen><p:emision titulo="Campanadas 2016 en Canarias" fecha="2017-01-01" tiempo="00:14:59" URL="http://www.rtve.es/m/alacarta/videos/campanadas-de-fin-de-ano/campanadas-2016-canarias/3851479/?media=tve"></p:emision><p:emision titulo="Campanadas 2016" fecha="2016-12-31" tiempo="00:19:58" URL="http://www.rtve.es/m/alacarta/videos/campanadas-de-fin-de-ano/campanadas-2016/3851484/?media=tve"></p:emision><p:emision titulo="Campanadas Fin de año 2015 Canarias" fecha="2016-01-01" tiempo="00:7:45" URL="http://www.rtve.es/m/alacarta/videos/campanadas-de-fin-de-ano/campanadas-fin-ano-2015-canarias/3430621/?media=tve"></p:emision><p:emision titulo="Campanadas de Fin de Año 2015" fecha="2016-01-01" tiempo="00:5:28" URL="http://www.rtve.es/m/alacarta/videos/campanadas-de-fin-de-ano/campanadas-fin-ano-2016/3430458/?media=tve"></p:emision><p:emision titulo="Campanadas 2015" fecha="2015-12-31" tiempo="00:23:24" URL="http://www.rtve.es/m/alacarta/videos/campanadas-de-fin-de-ano/campanadas-2015/3430768/?media=tve"></p:emision><p:emision titulo="Campanadas Fin de año 2014 Canarias" fecha="2015-01-01" tiempo="00:9:36" URL="http://www.rtve.es/m/alacarta/videos/campanadas-de-fin-de-ano/campanadas-fin-ano-2014-canarias/2936476/?media=tve"></p:emision><p:emision titulo="Campanadas 2015" fecha="2014-12-31" tiempo="00:22:38" URL="http://www.rtve.es/m/alacarta/videos/campanadas-de-fin-de-ano/campanadas-2014/2936494/?media=tve"></p:emision><p:emision titulo="Campanadas de Fin de Año 2013" fecha="2013-12-31" tiempo="00:16:36" URL="http://www.rtve.es/m/alacarta/videos/campanadas-de-fin-de-ano/campanadas-entrada-2014-anne-igartiburu-pepe-rodriguez-jordi-cruz-desde-puerta-del-sol/2276053/?media=tve"></p:emision></p:programa>