<?xml version="1.0" ?><p:programa xmlns:p="http://www.example.org/ejercicio1-2" xmlns:xsi="http://www.w3.org/2001/XMLSchema-instance" xsi:schemaLocation="http://www.example.org/ejercicio1-2 Ejercicio1-2.xsd " id="audiencia-abierta"><p:nombre>Audiencia abierta</p:nombre><p:URLprograma>http://www.rtve.es/m/alacarta/videos/audiencia-abierta/?media=tve</p:URLprograma><p:URLimagen>http://img.rtve.es/imagenes/audiencia-abierta/1349952396013.jpg</p:URLimagen><p:emision titulo="Audiencia Abierta - 25/03/17  " fecha="2017-03-25" tiempo="00:30:50" URL="http://www.rtve.es/m/alacarta/videos/audiencia-abierta/audiencia-abierta-25-03-17/3956620/?media=tve"></p:emision><p:emision titulo="Audiencia Abierta - 18/03/17     " fecha="2017-03-18" tiempo="00:30:32" URL="http://www.rtve.es/m/alacarta/videos/audiencia-abierta/audiencia-abierta-18-03-17/3948316/?media=tve"></p:emision><p:emision titulo="Audiencia Abierta - 11/03/17      " fecha="2017-03-11" tiempo="00:30:57" URL="http://www.rtve.es/m/alacarta/videos/audiencia-abierta/audiencia-abierta-11-03-17/3940983/?media=tve"></p:emision><p:emision titulo="Audiencia Abierta - 04/03/17            " fecha="2017-03-04" tiempo="00:30:46" URL="http://www.rtve.es/m/alacarta/videos/audiencia-abierta/audiencia-abierta-04-03-17/3933606/?media=tve"></p:emision><p:emision titulo="Audiencia Abierta - 25/02/17  " fecha="2017-02-25" tiempo="00:30:46" URL="http://www.rtve.es/m/alacarta/videos/audiencia-abierta/audiencia-abierta-25-02-17/3925861/?media=tve"></p:emision><p:emision titulo="Audiencia Abierta - 18/02/17" fecha="2017-02-18" tiempo="00:34:36" URL="http://www.rtve.es/m/alacarta/videos/audiencia-abierta/audiencia-abierta-18-02-17/3918930/?media=tve"></p:emision><p:emision titulo="Audiencia Abierta - 11/02/17" fecha="2017-02-11" tiempo="00:29:47" URL="http://www.rtve.es/m/alacarta/videos/audiencia-abierta/audiencia-abierta-11-02-17/3910959/?media=tve"></p:emision><p:emision titulo="Audiencia Abierta - 04/02/17 " fecha="2017-02-04" tiempo="00:30:32" URL="http://www.rtve.es/m/alacarta/videos/audiencia-abierta/audiencia-abierta-04-02-17/3899920/?media=tve"></p:emision></p:programa>