<?xml version="1.0" ?><p:programa xmlns:p="http://www.example.org/ejercicio1-2" xmlns:xsi="http://www.w3.org/2001/XMLSchema-instance" xsi:schemaLocation="http://www.example.org/ejercicio1-2 Ejercicio1-2.xsd " id="carlos-rey-emperador"><p:nombre>Carlos, Rey Emperador</p:nombre><p:URLprograma>http://www.rtve.es/m/alacarta/videos/carlos-rey-emperador/?media=tve</p:URLprograma><p:URLimagen>http://img.rtve.es/imagenes/carlos-rey-emperador/1488798893664.png</p:URLimagen><p:emision titulo="Capítulo 17" fecha="2016-01-25" tiempo="00:1:14" URL="http://www.rtve.es/m/alacarta/videos/carlos-rey-emperador/carlos-rey-cap17-220116/3455326/?media=tve"></p:emision><p:emision titulo="Capítulo 16" fecha="2016-01-25" tiempo="00:1:17" URL="http://www.rtve.es/m/alacarta/videos/carlos-rey-emperador/carlos-rey-cap16/3455288/?media=tve"></p:emision><p:emision titulo="Capítulo 15" fecha="2016-01-18" tiempo="00:1:15" URL="http://www.rtve.es/m/alacarta/videos/carlos-rey-emperador/carlos-cap15-120116/3441799/?media=tve"></p:emision><p:emision titulo="Capítulo 14" fecha="2016-01-11" tiempo="00:1:17" URL="http://www.rtve.es/m/alacarta/videos/carlos-rey-emperador/carlos-rey-emperador-cap14/3438518/?media=tve"></p:emision><p:emision titulo="Capítulo 13" fecha="2015-11-23" tiempo="00:1:17" URL="http://www.rtve.es/m/alacarta/videos/carlos-rey-emperador/carlos-cap13-201115/3372984/?media=tve"></p:emision><p:emision titulo="Capítulo 12" fecha="2015-11-23" tiempo="00:1:18" URL="http://www.rtve.es/m/alacarta/videos/carlos-rey-emperador/carlos-rey-emperador-capitulo-12/3372465/?media=tve"></p:emision><p:emision titulo="Capítulo 11" fecha="2015-11-16" tiempo="00:1:15" URL="http://www.rtve.es/m/alacarta/videos/carlos-rey-emperador/carlos-cap11/3361661/?media=tve"></p:emision><p:emision titulo="Capítulo 10" fecha="2015-11-09" tiempo="00:1:15" URL="http://www.rtve.es/m/alacarta/videos/carlos-rey-emperador/carlos-rey-cap-10-051015/3348777/?media=tve"></p:emision></p:programa>