<?xml version="1.0" ?>
<p:programa xmlns:p="http://www.example.org/ejercicio1-2"
	xmlns:xsi="http://www.w3.org/2001/XMLSchema-instance"
	xsi:schemaLocation="http://www.example.org/ejercicio1-2 Ejercicio1-2.xsd "
	id="acacias-38">
	<p:nombre>Acacias 38</p:nombre>
	<p:URLprograma>http://www.rtve.es/m/alacarta/videos/acacias-38/?media=tve</p:URLprograma>
	<p:URLimagen>http://img.rtve.es/imagenes/acacias-38/1425305370705.png</p:URLimagen>
	<p:emision titulo="Capítulo 510  " fecha="2017-05-08" tiempo="00:52:30"
		URL="http://www.rtve.es/m/alacarta/videos/acacias-38/acacias-38-capitulo-510/4011500/?media=tve"></p:emision>
	<p:emision titulo="Capítulo 509" fecha="2017-05-05" tiempo="00:52:13"
		URL="http://www.rtve.es/m/alacarta/videos/acacias-38/acacias-38-capitulo-509/4008271/?media=tve"></p:emision>
	<p:emision titulo="Capítulo 508" fecha="2017-05-04" tiempo="00:52:13"
		URL="http://www.rtve.es/m/alacarta/videos/acacias-38/acacias-38-capitulo-508/4006809/?media=tve"></p:emision>
	<p:emision titulo="Capítulo 507" fecha="2017-05-03" tiempo="00:52:47"
		URL="http://www.rtve.es/m/alacarta/videos/acacias-38/acacias-38-capitulo-507/4005277/?media=tve"></p:emision>
	<p:emision titulo="Capítulo 506" fecha="2017-05-02" tiempo="00:52:24"
		URL="http://www.rtve.es/m/alacarta/videos/acacias-38/acacias-38-capitulo-506/4003639/?media=tve"></p:emision>
	<p:emision titulo="Capítulo 505" fecha="2017-04-28" tiempo="00:52:21"
		URL="http://www.rtve.es/m/alacarta/videos/acacias-38/acacias-38-capitulo-505/3999036/?media=tve"></p:emision>
	<p:emision titulo="Capítulo 504" fecha="2017-04-27" tiempo="00:52:14"
		URL="http://www.rtve.es/m/alacarta/videos/acacias-38/acacias-38-capitulo-504/3997245/?media=tve"></p:emision>
	<p:emision titulo="Capítulo 503" fecha="2017-04-26" tiempo="00:53:40"
		URL="http://www.rtve.es/m/alacarta/videos/acacias-38/acacias-38-capitulo-503/3995452/?media=tve"></p:emision>
</p:programa>