<?xml version="1.0" ?><p:programa xmlns:p="http://www.example.org/ejercicio1-2" xmlns:xsi="http://www.w3.org/2001/XMLSchema-instance" xsi:schemaLocation="http://www.example.org/ejercicio1-2 Ejercicio1-2.xsd " id="canarias-mediodia"><p:nombre>Canarias Mediodía</p:nombre><p:URLprograma>http://www.rtve.es/m/alacarta/videos/canarias-mediodia/?media=tve</p:URLprograma><p:URLimagen>http://img.rtve.es/imagenes/canarias-mediodia/1317031403724.jpg</p:URLimagen><p:emision titulo="Canarias Mediodía - 27/07/12" fecha="2012-07-27" tiempo="00:18:19" URL="http://www.rtve.es/m/alacarta/videos/canarias-mediodia/canarias-mediodia-27-07-12/1492416/?media=tve"></p:emision><p:emision titulo="Canarias Mediodía - 26/07/2012" fecha="2012-07-26" tiempo="00:20:13" URL="http://www.rtve.es/m/alacarta/videos/canarias-mediodia/canarias-mediodia-26-07-2012/1491538/?media=tve"></p:emision><p:emision titulo="Canarias Mediodía 25/07/2012" fecha="2012-07-25" tiempo="00:20:39" URL="http://www.rtve.es/m/alacarta/videos/canarias-mediodia/canarias-mediodia-25-07-2012/1490635/?media=tve"></p:emision><p:emision titulo="Canarias Mediodía - 24/07/2012" fecha="2012-07-24" tiempo="00:20:24" URL="http://www.rtve.es/m/alacarta/videos/canarias-mediodia/canarias-mediodia-24-07-2012/1489806/?media=tve"></p:emision><p:emision titulo="Canarias Mediodía - 23/07/2012" fecha="2012-07-23" tiempo="00:19:46" URL="http://www.rtve.es/m/alacarta/videos/canarias-mediodia/canarias-mediodia-23-07-2012/1489425/?media=tve"></p:emision><p:emision titulo="Canarias mediodia - 20/07/12" fecha="2012-07-20" tiempo="00:20:39" URL="http://www.rtve.es/m/alacarta/videos/canarias-mediodia/canarias-mediodia-20-07-12/1485750/?media=tve"></p:emision><p:emision titulo="Canarias Mediodía -19/07/2012" fecha="2012-07-19" tiempo="00:20:43" URL="http://www.rtve.es/m/alacarta/videos/canarias-mediodia/canarias-mediodia-19-07-2012/1470265/?media=tve"></p:emision><p:emision titulo="Canarias Mediodía - 18/07/2012" fecha="2012-07-18" tiempo="00:22:38" URL="http://www.rtve.es/m/alacarta/videos/canarias-mediodia/canarias-mediodia-18-07-2012/1468503/?media=tve"></p:emision></p:programa>