<?xml version="1.0" ?><p:programa xmlns:p="http://www.example.org/ejercicio1-2" xmlns:xsi="http://www.w3.org/2001/XMLSchema-instance" xsi:schemaLocation="http://www.example.org/ejercicio1-2 Ejercicio1-2.xsd " id="capitan-q"><p:nombre>Capitán Q</p:nombre><p:URLprograma>http://www.rtve.es/m/alacarta/videos/capitan-q/?media=tve</p:URLprograma><p:URLimagen>http://img.rtve.es/imagenes/capitan/1432547648387.png</p:URLimagen><p:emision titulo="Un final de viaje con sabor vasco" fecha="2016-09-08" tiempo="00:1:02" URL="http://www.rtve.es/m/alacarta/videos/capitan-q/capitan-final-viaje-sabor-vasco/3713673/?media=tve"></p:emision><p:emision titulo="Costa asturiana" fecha="2016-09-07" tiempo="00:57:24" URL="http://www.rtve.es/m/alacarta/videos/capitan-q/capitan-costa-asturiana/3712581/?media=tve"></p:emision><p:emision titulo="Galicia y la temida 'Costa da Morte'" fecha="2016-09-06" tiempo="00:57:03" URL="http://www.rtve.es/m/alacarta/videos/capitan-q/capitan-galicia-temida-costa-da-morte/3711592/?media=tve"></p:emision><p:emision titulo="De aventura en las costas de Cádiz" fecha="2016-09-05" tiempo="00:55:36" URL="http://www.rtve.es/m/alacarta/videos/capitan-q/capitan-aventura-costas-cadiz/3710754/?media=tve"></p:emision><p:emision titulo="El Estrecho de Gibraltar" fecha="2016-09-02" tiempo="00:50:44" URL="http://www.rtve.es/m/alacarta/videos/capitan-q/capitan-estrecho-gibraltar/3708946/?media=tve"></p:emision><p:emision titulo="Jávea - Isleta del Moro" fecha="2016-09-01" tiempo="00:53:35" URL="http://www.rtve.es/m/alacarta/videos/capitan-q/capitan-javea-isleta-del-moro/3707986/?media=tve"></p:emision><p:emision titulo="Sant Carles de la Râpita-Ibiza" fecha="2016-08-31" tiempo="00:53:07" URL="http://www.rtve.es/m/alacarta/videos/capitan-q/capitan-sant-carles-rapita-ibiza/3707209/?media=tve"></p:emision><p:emision titulo="Cadaqués - L'Ametlla de Mar" fecha="2016-08-30" tiempo="00:53:11" URL="http://www.rtve.es/m/alacarta/videos/capitan-q/capitan-cadaques-lametlla-mar/3706299/?media=tve"></p:emision></p:programa>