<?xml version="1.0" ?><p:programa xmlns:p="http://www.example.org/ejercicio1-2" xmlns:xsi="http://www.w3.org/2001/XMLSchema-instance" xsi:schemaLocation="http://www.example.org/ejercicio1-2 Ejercicio1-2.xsd " id="buscamundos"><p:nombre>Buscamundos</p:nombre><p:URLprograma>http://www.rtve.es/m/alacarta/videos/buscamundos/?media=tve</p:URLprograma><p:URLimagen>http://img.rtve.es/imagenes/buscamundos/1294827239577.png</p:URLimagen><p:emision titulo="Egipto" fecha="2013-01-09" tiempo="00:58:11" URL="http://www.rtve.es/m/alacarta/videos/buscamundos/buscamundos-egipto/1648422/?media=tve"></p:emision><p:emision titulo="Turquía: la frontera de Asia" fecha="2012-12-19" tiempo="00:55:22" URL="http://www.rtve.es/m/alacarta/videos/buscamundos/buscamundos-turquia-frontera-asia/1618342/?media=tve"></p:emision><p:emision titulo="Vietnam" fecha="2012-12-12" tiempo="00:57:51" URL="http://www.rtve.es/m/alacarta/videos/buscamundos/buscamundos-vietnam/1609223/?media=tve"></p:emision><p:emision titulo="Las Vegas, ciudad de mentira" fecha="2012-12-05" tiempo="00:59:39" URL="http://www.rtve.es/m/alacarta/videos/buscamundos/buscamundos-vegas-ciudad-mentira/1536154/?media=tve"></p:emision><p:emision titulo="Tanzania" fecha="2012-11-28" tiempo="00:57:55" URL="http://www.rtve.es/m/alacarta/videos/buscamundos/buscamundos-20121127-0025-169/1593054/?media=tve"></p:emision><p:emision titulo="Europa en crisis" fecha="2012-11-21" tiempo="00:57:36" URL="http://www.rtve.es/m/alacarta/videos/buscamundos/buscamundos-europa-crisis/1585322/?media=tve"></p:emision><p:emision titulo="Guatemala, tierra de volcanes " fecha="2012-11-14" tiempo="00:57:07" URL="http://www.rtve.es/m/alacarta/videos/buscamundos/buscamundos-guatemala-tierra-volcanes-leyendas/1284847/?media=tve"></p:emision><p:emision titulo="Los mares del fín del mundo" fecha="2012-11-07" tiempo="00:55:10" URL="http://www.rtve.es/m/alacarta/videos/buscamundos/buscamundos-mares-del-fin-del-mundoturismo-funerario/1572423/?media=tve"></p:emision></p:programa>